{
  "type": "experiment_plan",
  "schema_version": "v1",
  "produced_by": {"protocol": "minimum-experiment", "protocol_version": "0.1.0"},
  "provenance": {"input_artifacts": ["decision_memo.v1"], "sources": ["Fictional outreach estimate"]},
  "uncertainty": {"level": "medium", "unresolved": ["Response rate may vary by weekday"]},
  "payload": {
    "hypothesis": "Thirty warm contacts can produce five qualified interviews in 14 days",
    "action": "Send one reversible outreach message to 30 eligible organizations",
    "budget": "500 units and 12 staff hours",
    "duration": "14 days",
    "metrics": ["Qualified interviews booked", "Cost per interview"],
    "continue_threshold": "At least five qualified interviews by day 14",
    "stop_threshold": "Fewer than two positive replies after 20 contacts",
    "information_gain": "Estimate reachable demand before a full launch commitment"
  }
}
